{
  "network_id": "sonantia-network",
  "protocol_version": "1.0",
  "network_epoch": "SN1-2026-08-02",
  "message_id": "SN1-N01-2026-08-02T06-00-00Z-000001",
  "origin_node_id": "N01",
  "sequence": 1,
  "created_at": "2026-08-02T06:00:00Z",
  "visibility": "public",
  "language": "es",
  "text": "Primer mensaje de Red Sonantia Network v1.0.",
  "context": {
    "weather": null,
    "astronomy": null,
    "geology": null,
    "economy": null
  },
  "generator": {
    "generator_id": "sonantia-context-composer",
    "catalog_version": "1.0"
  },
  "content_hash": "sha256:a53625e41f0d15a7354e2b98ba718e24ee685f1dcd4fe353c92b52f54aa65f54"
}
